TC ID,Object,User Story,Scenario,Expected Result,AC Reference,Test Status,Duration (s),Error Message,Run Date
TC-ACC-001,Account,US-005,Verify existing Account has Billing Address and Payment Terms under Details tab (soft-fail if missing),Billing Address and Payment Terms fields are visible; test logs warning but does not hard-fail if absent,AC-005-01,not run,,,2026-04-27
TC-ACC-002,Account,US-005,Create a new Contact on the Account's Related tab,Contact is saved successfully and appears in the Account's Contacts related list,AC-005-02,not run,,,2026-04-27
TC-ACC-003,Account,US-005,Create a new Opportunity from the Contact's Related tab,Opportunity is saved successfully and linked to the Contact,AC-005-03,not run,,,2026-04-27
TC-ACC-004,Account,US-005,Verify newly created Contact is assigned as Primary Contact Role on the Opportunity,Contact appears in the Opportunity's Contact Roles related list with role marked Primary,AC-005-04,not run,,,2026-04-27
TC-ACC-005,Account,US-005,Create a Quote from the Opportunity using the Create Quote button,Quote record is created and saved; user lands on the new Quote detail page,QO-005-05,not run,,,2026-04-27
