TC ID,Object,User Story,Scenario,Expected Result,AC Reference,Test Status,Duration (s),Error Message,Run Date
TC-ACC-001,Account,US-005,Verify existing Account has Billing Address and Payment Terms under Details tab,Billing Address and Payment Terms logged (soft-fail if absent); accountUrl contains /Account/,AC-005-01,passed,6.45,TimeoutError: locator.waitFor: Timeout 5000ms exceeded.,2026-04-28
TC-ACC-002,Account,US-005,Create a new Contact on the Account and capture the Contact URL,Contact saved successfully; contactUrl contains /Contact/,AC-005-02,skipped,0.00,,2026-04-28
TC-ACC-003,Account,US-005,Create Opportunity from Contact Related list and verify Primary Contact Role assignment,Opportunity created; opportunityUrl contains /Opportunity/; Primary Contact Role visible (soft-fail),"AC-005-03, AC-005-04",skipped,0.00,,2026-04-28
TC-ACC-004,Account,US-005,"Create Quote from Opportunity, Browse Catalogs, select Price Book, add product, validate cart",Quote created; product appears in cart; quoteUrl contains /Quote/,"QO-005-05, PC-005-06, PC-005-07, PC-005-08, PC-005-09",skipped,0.00,,2026-04-28
TC-ACC-005,Account,US-005,"Accept Quote, create Contract, activate Contract, create Order from Quote and activate Order",Contract Activated; Order created and marked complete,"QL-005-10, QL-005-11, CR-005-12, OR-005-13, OR-005-14, OR-005-15, OR-005-16",skipped,0.00,,2026-04-28
